{
  "$schema": "https://json-schema.org/draft/2020-12/schema",
  "$id": "https://shortsmith.local/schemas/editorial-video/source-record.schema.json",
  "title": "Editorial source record",
  "type": "object",
  "additionalProperties": false,
  "required": [
    "version",
    "id",
    "connectorId",
    "url",
    "canonicalUrl",
    "publisher",
    "title",
    "author",
    "publishedAt",
    "retrievedAt",
    "language",
    "contentType",
    "summary",
    "shortExcerpts",
    "entities",
    "topics",
    "sourceHash",
    "usagePolicy",
    "status"
  ],
  "properties": {
    "version": {
      "const": 1
    },
    "id": {
      "$ref": "#/$defs/id"
    },
    "connectorId": {
      "enum": [
        "manual",
        "rss",
        "json-feed",
        "fixture"
      ]
    },
    "url": {
      "$ref": "#/$defs/sourceUrl"
    },
    "canonicalUrl": {
      "$ref": "#/$defs/sourceUrl"
    },
    "publisher": {
      "type": "string",
      "minLength": 1,
      "maxLength": 160
    },
    "title": {
      "type": "string",
      "minLength": 1,
      "maxLength": 300
    },
    "author": {
      "type": [
        "string",
        "null"
      ],
      "maxLength": 160
    },
    "publishedAt": {
      "oneOf": [
        {
          "$ref": "#/$defs/timestamp"
        },
        {
          "type": "null"
        }
      ]
    },
    "retrievedAt": {
      "$ref": "#/$defs/timestamp"
    },
    "language": {
      "type": "string",
      "pattern": "^[a-z]{2}(?:-[A-Z]{2})?$"
    },
    "contentType": {
      "enum": [
        "article",
        "press-release",
        "report",
        "feed-entry",
        "document",
        "manual"
      ]
    },
    "summary": {
      "type": "string",
      "minLength": 1,
      "maxLength": 2000
    },
    "shortExcerpts": {
      "type": "array",
      "maxItems": 12,
      "items": {
        "type": "string",
        "minLength": 1,
        "maxLength": 500
      }
    },
    "entities": {
      "type": "array",
      "maxItems": 100,
      "items": {
        "type": "object",
        "additionalProperties": false,
        "required": [
          "name",
          "type"
        ],
        "properties": {
          "name": {
            "type": "string",
            "minLength": 1,
            "maxLength": 160
          },
          "type": {
            "enum": [
              "person",
              "organization",
              "company",
              "country",
              "institution",
              "currency",
              "ticker",
              "commodity",
              "other"
            ]
          },
          "ticker": {
            "type": [
              "string",
              "null"
            ],
            "maxLength": 20
          }
        }
      }
    },
    "topics": {
      "type": "array",
      "maxItems": 40,
      "uniqueItems": true,
      "items": {
        "type": "string",
        "minLength": 1,
        "maxLength": 80
      }
    },
    "sourceHash": {
      "$ref": "#/$defs/sha256"
    },
    "usagePolicy": {
      "type": "object",
      "additionalProperties": false,
      "required": [
        "maySynthesize",
        "mayQuote",
        "maximumExcerptCharacters",
        "retentionDays"
      ],
      "properties": {
        "maySynthesize": {
          "type": "boolean"
        },
        "mayQuote": {
          "type": "boolean"
        },
        "maximumExcerptCharacters": {
          "type": "integer",
          "minimum": 0,
          "maximum": 1000
        },
        "retentionDays": {
          "type": "integer",
          "minimum": 0,
          "maximum": 3650
        },
        "license": {
          "type": [
            "string",
            "null"
          ],
          "maxLength": 200
        }
      }
    },
    "status": {
      "enum": [
        "ready",
        "incomplete",
        "excluded",
        "error"
      ]
    }
  },
  "$defs": {
    "id": {
      "type": "string",
      "pattern": "^[a-z][a-z0-9-]{2,95}$"
    },
    "sourceUrl": {
      "type": "string",
      "maxLength": 2048,
      "pattern": "^(?:https://|fixture://)[^\\s]+$"
    },
    "timestamp": {
      "type": "string",
      "pattern": "^\\d{4}-\\d{2}-\\d{2}T\\d{2}:\\d{2}:\\d{2}(?:\\.\\d{3})?Z$"
    },
    "sha256": {
      "type": "string",
      "pattern": "^[a-f0-9]{64}$"
    }
  }
}
